Listing ID,Seller ID,Title,Description,Price,Category,Available
Rve4lobeBE,Gws2iT8a,Xbox Series S,Interest house actually player. Tree they whom suggest wall message interesting. Do bar experience available each dog Mrs.,204.98,Gaming Consoles,True
IIjyeoEiTH,noxEi3Ii,Samsung Galaxy Tab S7,White know school way war.,4999.16,Tablets,True
hFfPmr2sIN,ZLXoCpbv,Xbox Series S,Whom play he show trip way two. Certainly dark plant possible. Pick sit father someone end cause apply.,4378.58,Gaming Consoles,False
B6Vhrp5P7k,rBr5yVgo,ASUS ROG Swift PG259QN,Address quite thing must approach. Within city stuff cover seven.,2672.8,Monitors,False
Sb3O2xPsNt,8NJA4dd5,Razer DeathAdder Elite,Almost daughter figure remember able black. Board clearly country natural white field.,4172.91,Accessories,False
ZkIxjpFpt2,yX340Mt2,Nintendo Switch OLED,Audience project lead term. Marriage land any foreign expert.,4827.82,Gaming Consoles,False
utFCtXIvOV,JQ84N3Gk,Microsoft Office 365,Environment specific right treatment. Speak anyone amount turn business today. Data table paper event standard.,2971.98,Software,True
Kratln0OT3,GDd7lmXN,Canon EOS R5,Feel idea member accept clear billion. Performance answer marriage already someone. Line five similar ago way young value.,3986.55,Cameras,False
HbCF6D44Gi,okNMS65U,BenQ ZOWIE XL2411P,Process offer deep learn blue. Begin three range probably ground they.,2663.06,Monitors,True
tKaqMgQFD4,2qI45So7,Autodesk AutoCAD 2022,May possible simple increase. Hot beat recent accept magazine dream. Cause speak across computer after. Think agency decade traditional level short situation manager.,4174.45,Software,True
jb3cahgJf7,mYKdzs9H,Microsoft Office 365,Another company decade total court on outside. Religious within available people conference.,2324.73,Software,True
aqZ4QcVEGh,VXutOPEq,Microsoft Office 365,Agency run minute offer. See none about research fly.,2414.61,Software,False
0vBYz7FfjJ,lcWcNOF3,Microsoft Surface Pro 7,Buy item want look. West night across against between sense. Matter at ability attorney.,613.04,Tablets,False
T9YT5tNc7c,oB3gzB7B,ASUS ROG Swift PG259QN,Gas break last since model. Spring little cultural turn commercial apply issue. Training agency stage notice evidence thank. Live institution south Congress represent.,3188.67,Monitors,True
3wcclMgbdf,HpUTsAbc,Nintendo Switch OLED,Perhaps effort reality computer majority large fly. Carry police would scientist position per box conference.,1421.3,Gaming Consoles,False
T2g4OxVk6W,ysnY7E8P,Panasonic Lumix GH5,Decision specific develop senior. Adult side under speech enough attack.,2384.18,Cameras,False
WPGUMUYXdQ,MigYdFHM,Samsung Odyssey G7,People present increase minute evening up property. Bed avoid budget if environmental avoid. Once choose memory five.,1647.07,Monitors,True
7Ufgh86Q7f,TLYZMt6P,Sony PlayStation 5,Everything million because former level drop. Free event cell carry simply threat allow.,1091.42,Gaming Consoles,False
0aXXGm3SW9,OyAWEcm2,Sony PlayStation 5,Team sister discussion cell though. Return month task few along law western indeed. Would career company possible. Charge concern see know product position.,4195.67,Gaming Consoles,False
px0LVV2mrR,GMxJbixu,Apple AirPods Pro,Adult word bring drive or. Sign American share into you less hit.,2843.2,Headphones,True
l8YodH4sPs,jngw8qdW,Fitbit Versa 3,Fear let level task last. Space method arrive finish little kitchen himself.,1613.87,Smartwatches,False
MrB3nLyzvH,sjE17PgF,Sony Alpha a7 III,Series center arm first carry he vote. Include else natural control window present. Class least information early throw.,3073.45,Cameras,False
qdw68rwayu,wTVoytKL,Apple Watch Series 7,Long eye bring investment at fact. Similar significant early total interesting administration.,67.26,Smartwatches,False
LbLrpDFzd0,fd45PdTl,JBL Live 650BTNC,Decade present outside. Peace together structure possible control. Figure realize big medical member security student nothing.,4779.71,Headphones,False
i4zOcT6933,PBXYu5eS,Microsoft Surface Laptop 4,Finish hair particularly alone stop study. Old recently usually chair floor hospital meeting. Thus know soldier.,3425.08,Laptops,False
GnrBFamyon,kYT09Ccw,Nintendo Switch OLED,Child certainly town how and beyond agreement.,4347.66,Gaming Consoles,False
DsCpATS2rM,rY10Ffp9,Samsung Galaxy Tab S7,Themselves he young interview office health. Pay spring month true.,4002.27,Tablets,True
9JNCETDBUe,IXWF1J0g,BenQ ZOWIE XL2411P,Land focus maybe lot night station address. Suddenly movie political avoid. Financial guess site night. Paper reduce tell news education bar report.,3395.79,Monitors,False
4kJZSGTaKR,oEzp9csu,Fitbit Versa 3,Game dog tree street leader. Government six black series second gun church.,1714.85,Smartwatches,False
sK9IqcXdwF,PekvF9b4,Apple Watch Series 7,Manager will level ever other their read.,752.33,Smartwatches,True
JiIqguNP4e,iOi7TCM7,Samsung Galaxy S21,Interest eye resource above center onto. Six region maybe this bar. Mother sister professional sometimes central late.,4431.2,Smartphones,True
hRYG191KMD,fXsCpw4w,Canon EOS R5,Task specific current garden effort item defense develop. Them western lawyer get read.,3380.53,Cameras,False
6hyL7x1Aex,rKILbmtO,Sony Xperia 1 II,Down level control under worker born. Picture let consumer section beat behavior. Factor reach us up.,3072.44,Smartphones,False
7mXgnhiIpn,Y6TKhxp4,Samsung Galaxy Tab S7,Since up identify real central. Development organization despite among assume similar either.,3506.35,Tablets,False
98rgiXPQHZ,Ehl3QDYK,Apple Watch Series 7,Assume behind trouble baby beyond glass. You during choose go food pressure. No approach might current all identify add.,4708.22,Smartwatches,True
7fEO3SBCwV,uRca8Xm3,Microsoft Surface Laptop 4,Another already maintain clearly up become. Party yeah American watch key. Range without small series different stuff.,2949.83,Laptops,False
HY24HUMV7l,VDbsX2Fn,Microsoft Office 365,Respond visit act large son place. World small window party audience political. War speech within control.,1323.52,Software,True
