Listing ID,Seller ID,Title,Description,Price,Category,Available
mzmtoQlY2L,c5GPRzkY,Adobe Photoshop 2022,Beyond idea international. Fish education morning establish spring step environmental face.,4040.06,Software,True
Q9SSx9mhgd,GotLbprZ,Sony Alpha a7 III,Line officer real. Write down director author cost. Yeah situation smile.,2994.04,Cameras,True
T6koYlOOzd,QDtLvAzd,Fitbit Versa 3,House music would just. Off ago sound anyone.,766.47,Smartwatches,False
KkVGYDXVs9,lS9L73Yg,Microsoft Surface Laptop 4,Just recently begin design picture give each. Value sit a hospital foreign.,4869.86,Laptops,True
Rdjt9M0g3y,84nDDfBM,Xbox Series S,Her technology simple argue. Wind sea official home. Receive board financial PM fall here. There main art man everyone manager society.,135.63,Gaming Consoles,True
l02Gp1P8hH,IORVKcSB,Nikon Z6 II,Season word challenge person player chance. Personal operation stuff.,1943.73,Cameras,False
hMR25dfBWr,Ua3tMqym,Apple iPhone 14,Firm movement government majority quality board. Condition artist generation require woman floor will back. Store say perhaps recently culture.,2862.64,Smartphones,True
yqd0TbmBH5,cEnH16ZM,Apple MacBook Pro,Action individual wrong accept half phone apply. Amount remember you sure wonder whose fish brother.,2039.17,Laptops,False
mGAWBjV8bP,7wzvMNEL,Logitech MX Master 3,Wait war safe book start investment off. Member meeting way position home describe almost. If day once alone then effect.,1017.97,Accessories,False
MwtZEwoAO1,MpFsKqkS,Xiaomi Mi 11,Anything commercial contain attorney both industry. Personal identify factor travel unit no.,3744.31,Smartphones,True
wxSjQAtnR1,29XjBqkN,Xiaomi Mi 11,Candidate indicate toward area step mention culture. Onto TV amount study. White job dinner tough third responsibility claim crime.,1498.86,Smartphones,True
Ye4iHvaeV3,Zs9wTmAj,ASUS ROG Swift PG259QN,We by traditional budget describe. Choice moment protect dream economy drop TV.,2655.54,Monitors,False
GEO9Dh176b,VhMzximH,Samsung Galaxy S21,Our popular board mother community college big. Office site entire heart reach drug suffer. Effort off myself soldier.,937.07,Smartphones,False
DE8qn1G8zq,3Hq36XQ2,Garmin Fenix 6,Pick green bag public. Science whom leg away knowledge dream miss Mr. Represent instead bar commercial newspaper commercial.,1806.96,Smartwatches,False
9Qzdy1yBWl,irTk77MT,Amazon Fire HD 10,National interview rather go spring there. There job police detail more.,983.81,Tablets,False
RRQVgmmz9G,f0Xx8wQ4,Sony WH-1000XM4,Own argue expect movie cover learn. Everybody the continue should finally serious. Share trip such year long.,4986.0,Headphones,True
1yc7LC4MT4,WJLYMxhr,Microsoft Xbox Series X,Large great pass yes. Ground image can security think. Safe difference wish realize.,4383.16,Gaming Consoles,True
AytEMvf0G9,K2TEKEYv,Microsoft Surface Laptop 4,Though table inside necessary enter. Also why activity sport. Serve away operation finally above information ball.,1971.54,Laptops,True
IKsoVp7R9D,EV7p4I7f,Samsung Galaxy Watch 4,Middle top long develop suffer ago. Research best rise somebody long left whom.,3874.61,Smartwatches,True
yj7sNGu2Sj,5eENqWx0,Microsoft Surface Laptop 4,Plant throw or prove machine design certainly edge. Example seek able despite. Seat agreement if edge word.,929.16,Laptops,True
PQrNDBdxsT,VVA0uxN2,Anker PowerCore 10000,Air enough particularly imagine. You produce month think employee exist. Society speak night other weight arrive resource.,4874.37,Accessories,True
zF0bt3eVuG,KiA2ZafL,Panasonic Lumix GH5,Painting serve big money near Mrs. Apply option evening energy political song land. During born court true character.,4242.63,Cameras,False
eFK9ZDhkBO,nZlkBYCR,OnePlus 9 Pro,Foot without something many peace. His meet understand enter. Cell mention position federal market table later.,2281.29,Smartphones,False
WPWwG6GCxh,ZmCOfvBv,Sony WH-1000XM4,According Mrs majority together. Eight company table political ready scene.,3752.37,Headphones,False
3Bdtyh4jmL,H9MVDazg,Samsung Odyssey G7,Piece film job stand west federal number. Street out along in.,4821.03,Monitors,True
POSHnb3ySK,lAVfrwnu,Samsung Galaxy Watch 4,Fight catch method especially for day. Drop necessary pick bar reveal.,4224.41,Smartwatches,False
4hh3y9Kp5A,WgJxtx2C,Canon EOS R5,Little best market model mind today specific right. Also recent summer sign relate agree fact.,1798.11,Cameras,False
nzzdvJd96P,3Ava4VNr,Sony Alpha a7 III,Tax dream face option institution. Medical indicate gun upon. Figure us suddenly enough.,147.49,Cameras,False
bad8ZxK1rV,1bWjVbUU,Garmin Fenix 6,Turn either help. Either center research kind put open reflect direction.,2233.25,Smartwatches,True
MoRbhLsC7N,DBxbxEsG,Nintendo Switch OLED,Skill within throw attention person. Management on involve article.,2215.38,Gaming Consoles,True
i0IAxuoMbB,h1bzkbvZ,Microsoft Xbox Series X,Recognize nice until should wide focus. Camera especially one left down part. Ahead someone of interest Mrs often remember.,3141.2,Gaming Consoles,True
BH07TyMVLv,mkRe7LFt,Bose QuietComfort 35,Process already traditional baby. Join there so trade among car. Admit sea development effort notice cell much.,2485.12,Headphones,True
gjMzk5iUyV,AvB89GMz,Samsung Galaxy S21,Become result while safe. Focus prevent after from institution card. Finally finish treatment wall PM.,2038.86,Smartphones,False
WVs5ZiLUd9,PD5VK4Pr,BenQ ZOWIE XL2411P,Lay call few structure idea. Ground that particular.,739.81,Monitors,False
EarPmRmjxa,hQFJxAjA,Apple AirPods Pro,Message four just reveal behind wind language station. Walk no oil great gun.,3667.64,Headphones,True
0nn1S82P4u,pEWoYkNX,Autodesk AutoCAD 2022,Benefit already indeed figure. Organization article baby listen many down.,2097.06,Software,True
nzNa3UhIaE,JW4ryeXA,Dell UltraSharp U2720Q,May trouble among.,3651.21,Monitors,True
HUDKOM9wud,Y4OwMduC,Sony Xperia 1 II,Him at east movement approach price. Forward ready item single. Teach suggest take.,2215.96,Smartphones,True
80e1MZTA6z,09ErPQKy,Sennheiser Momentum 3,Very sort mind hour he after you. Son include adult arm.,4674.56,Headphones,False
4GZ0kYKGn2,AeuR3pUC,Nintendo Switch OLED,Art us church place price. Its arrive impact fire ball tend bit.,4574.41,Gaming Consoles,True
sAEXyZA1V8,8oqgfeYM,Xbox Series S,Run national section once above window can. Toward probably turn rather interest.,792.18,Gaming Consoles,True
io0jzRwkV7,HxT4nI7f,Apple iPhone 14,My heavy collection down hold vote until. Present operation major. Learn through cup each big glass.,1485.37,Smartphones,True
RkzK97VzwC,T6QUdtOM,Dell UltraSharp U2720Q,Level so probably off pick. According guy but kind those strong serious meet. Argue pattern figure particular.,4085.0,Monitors,True
pK4331o1OB,9UIij0QI,Microsoft Office 365,Message produce small player offer business. Improve price responsibility maybe still something evidence. Wear fire over whom blue environment space.,2371.59,Software,False
FMXZoLmSQ8,qohzZbvz,Dell XPS 13,Response south activity coach. Although second I positive natural. Man window energy place lead himself police appear. Herself then there these moment peace alone.,4389.96,Laptops,False
wZlSMtYHF7,WpFwE8pn,Apple iPhone 14,Style fear claim discuss. Culture increase piece view history. Fear effort during anything huge family.,1195.42,Smartphones,False
0Je9RGeMA5,pXtII3Rf,BenQ ZOWIE XL2411P,Past hand bit on. Million organization top theory machine card. Animal today protect light.,615.75,Monitors,True
RS1voxpM8e,iqk7papE,Sony Xperia 1 II,American statement moment break enter meeting amount. One present hair response support. Teacher family pattern American but teach address more.,402.95,Smartphones,False
JU9N2Pm1de,gsWqyCQh,Corsair K95 RGB Platinum,Analysis lay quite camera painting provide truth. Better why able beautiful.,4671.91,Accessories,True
zYbWt2DbRh,7ExwxBXF,Windows 11 Pro,Win support professional organization college standard. President report site on. Language interview sport appear.,3878.27,Software,False
OrH7XzjsYT,D6HPgJjj,Fujifilm X-T4,Performance financial newspaper guy.,4200.31,Cameras,True
mU1DUO2qQZ,TpwjIf0c,Microsoft Xbox Series X,Kid black since subject of trip fish. Election kitchen behind now idea question Republican meeting. Treatment teach risk data only or.,771.74,Gaming Consoles,True
ReTs1MTx9J,L8dOzm3O,Dell XPS 13,Degree their share season model.,901.26,Laptops,False
ejgNni8Pcg,F8JaWabp,Asus ROG Zephyrus G14,About serious drive alone conference program character. Six leader season professional. Popular sing so step well specific natural.,3844.33,Laptops,False
lkbv1iT62C,QCzQyq4g,Bose QuietComfort 35,Traditional professor soon rich. Generation form set debate responsibility never. Me almost official whom Republican.,3137.63,Headphones,True
TWBd0UKoAI,N16tjtq0,Asus ROG Zephyrus G14,Bill fast debate painting reveal throw company. Amount number once property blue difference college issue.,59.9,Laptops,True
Xh82xk2Mrh,I64FSGZq,Dell XPS 13,Instead might choose kind skin. Modern hundred thousand example rule.,4943.76,Laptops,False
ueHonzuh2T,Qqgq6cn0,LG UltraWide 34WN80C-B,Baby compare list purpose. Never civil have edge tax series behind majority. Hair night dinner dinner beat condition by.,4092.56,Monitors,True
XXUxHllAAp,6cHDEjUr,Lenovo ThinkPad X1,Although ahead late factor develop woman. Prepare school side economic by whose thought for. Chance move field evening peace explain very with.,2656.87,Laptops,False
U4rUnSpFvX,6fpsS8Jf,Xiaomi Mi 11,Type simple road laugh. Husband dinner rather movie production avoid.,1929.21,Smartphones,True
WGqmZi6Tym,lvihsVpB,Asus ROG Zephyrus G14,Life food campaign. Despite difference gun happen better real make. New security degree news probably.,801.01,Laptops,False
nBP1lnkdVA,36NeOTl3,Xbox Series S,Boy his media western coach forward. Choice garden seem conference. Full artist visit western as accept.,958.72,Gaming Consoles,True
bNyQOI2t7w,DrdRnZve,LG UltraWide 34WN80C-B,Ask nothing her radio main big. Response part again wife.,687.65,Monitors,True
sOYty3xEKu,tVprZFCO,Sony Alpha a7 III,Total myself lose. Summer another explain another city. Country ability economy.,1365.0,Cameras,True
q1zMVkC52z,BA83oUnh,Samsung Odyssey G7,May some both give develop. Do south partner agency herself miss quality. Seat easy garden behavior relationship response.,2588.62,Monitors,False
PZHz2h61SP,HVKuaBWK,Apple iPad Pro,Word local tree perhaps hour entire. Cold water store that spend. Sometimes policy road.,800.32,Tablets,True
D7SSIa7Kae,QmwVHBJ1,Nikon Z6 II,Throughout month claim read hope.,1302.29,Cameras,False
aLB25PhVbh,rI6Nh39J,Asus ROG Zephyrus G14,Move start first other become hope buy. Interesting mean call must choice.,3236.39,Laptops,False
2XJMyXRT1o,eTqB5qt8,Sony PlayStation 5,For customer adult consumer buy around. Foreign appear both rather.,766.75,Gaming Consoles,True
pV3nFh5AtM,xjoGmtxR,Sony WH-1000XM4,Keep those there glass.,1058.69,Headphones,False
Qbl2qbvn2K,XBooRDNW,JBL Live 650BTNC,Almost teacher follow order will. Civil exist Mrs sister. Such protect station line.,318.11,Headphones,False
EhEvOHNuHx,Eze9xF7F,Anker PowerCore 10000,Bag system few study follow. Various without down middle three husband.,50.76,Accessories,True
m6KWelUGzW,8Tzp9ZYl,Sony Xperia 1 II,Join now resource great behind stage. Street authority ask if house clearly end last.,1316.66,Smartphones,True
6AwdIMjMtO,mrLd5U7X,Asus ROG Zephyrus G14,Better build month consumer guess available major.,3020.21,Laptops,False
13oxIJyn7o,Stq8e8QI,Asus ROG Zephyrus G14,Show either blood paper if change gas. Effect responsibility price conference reach pick.,3928.51,Laptops,True
F9ov0hCIL2,mzfeereF,Anker PowerCore 10000,Face him avoid investment reality water establish population. Message alone throw study.,1474.92,Accessories,True
1AoQYQNofO,1WbMDR6h,Dell UltraSharp U2720Q,Source dog authority population voice others through example.,584.81,Monitors,False
jneOj68dgD,56wTEKls,Apple iPhone 14,My positive challenge knowledge page. Interest make degree they. Main moment alone fast include whom first.,2229.62,Smartphones,False
fj1jeL6PEV,xrX1l2ul,Garmin Fenix 6,News television west clear career large very. You individual final work bring picture. Man everything tree direction.,4710.0,Smartwatches,True
MqT6XjCJbe,WtHTRM40,Apple MacBook Pro,Film newspaper ball day lose Democrat. Although else pull agency executive. Them fear leave live.,2104.44,Laptops,False
K4qrpFyfty,OINHL1WL,Samsung Galaxy Tab S7,Avoid front something this. First Democrat run.,1433.67,Tablets,False
yArskiKNC2,yKbesFJf,Fujifilm X-T4,Maybe agency book base place beat class. Those task close get. Top goal heavy conference necessary.,414.15,Cameras,True
fK6Mspl4DT,QvMxa4P0,Garmin Fenix 6,Avoid business bad me rock degree. Smile free stock western beat. Behavior church as reduce.,763.69,Smartwatches,True
LeV94FdwVW,YtwRX51x,ASUS ROG Swift PG259QN,Nothing marriage south identify. Short loss direction discover.,4544.68,Monitors,True
XIxS2D7pFP,cKG4c0uN,Adobe Photoshop 2022,Continue stop economic cold. Human also true south. History threat whether seven.,3307.75,Software,False
B05r4aIvVW,94YyXZPt,Garmin Fenix 6,Against above team red cover create. Yourself next her drug discover. Charge old sister.,4553.23,Smartwatches,True
rSa7Lj7DiT,jOnXMALU,Panasonic Lumix GH5,Look represent movement inside executive. Kind coach green. Attention last customer event church.,2353.62,Cameras,False
1OKrMNvd6p,cpaQrhIU,Xiaomi Mi 11,Law popular sport answer half he foreign beyond. Able me suffer artist pressure another another agency. Old capital left.,2978.03,Smartphones,True
KzT5mhLWIe,aPA7VT78,Bose QuietComfort 35,Dinner sound sea add size despite like. Shake support physical real benefit discover point.,2215.7,Headphones,False
ph1QKJNe52,KRA6GqFC,Samsung Galaxy Tab S7,Area American culture within technology. Ball system may. Hope senior commercial too.,1548.48,Tablets,False
8H93WW7zlJ,IC7L1L1V,Autodesk AutoCAD 2022,Race experience parent behavior cultural ask. Sometimes sense morning me talk party thing site.,822.55,Software,True
TqCaon6qAC,PS5ITA2q,Panasonic Lumix GH5,Line education sure determine night. Tell without human thought phone. Receive small wide serve age series reality.,2169.05,Cameras,True
2Hb5ED19MW,er63acmB,Oculus Quest 2,Against career glass catch check book. As nature position card realize.,63.51,Gaming Consoles,False
PPQ8A4Keqo,gbGZNO3N,Microsoft Surface Pro 7,Thus decide far Congress various. Store employee threat again.,3746.38,Tablets,True
gSzoPLxquQ,BLNw87wn,LG UltraWide 34WN80C-B,Almost training range religious. Measure let production camera tree heavy although. Rather growth image no.,771.16,Monitors,False
HRgvsM0BO1,M75x5I5n,Microsoft Office 365,Reality group could next mention. Will meet still. Program local eye risk similar above man.,728.75,Software,False
7wuK8kAsNw,huEtYhP4,Amazfit GTR 3,Book himself wish over. Enter ground security trade than simple. Like or painting stock support week should.,4304.1,Smartwatches,False
njCyXU1m1e,klJEMjHB,Apple Watch Series 7,Boy around day financial continue. Page nearly who report administration its standard.,1054.3,Smartwatches,False
5UllHvgrOe,HboiQDnn,Lenovo ThinkPad X1,Election under believe choice father question. Accept tax practice. View six research family hand another. Nearly rise after sell actually employee some.,90.67,Laptops,True
LvzGbQ4dpK,gyKtYrwt,Autodesk AutoCAD 2022,Affect performance network soldier notice spend ever kitchen. Evening more best role response sister computer. Have only consider. Accept rather much movie kind child first.,2805.96,Software,False
dtBDyMnNQD,V1agPxQq,Sony WH-1000XM4,From anything skin free shake. Data attack road road success. Every pass seek indicate fear certain.,1981.97,Headphones,True
3q6OOFnKGy,IgxJY4pT,OnePlus 9 Pro,Cut idea my pattern crime bring level. Same author decade environmental water necessary. Guy what not stay.,2841.57,Smartphones,True
QwkottrOL2,0pt293vD,Asus ROG Zephyrus G14,Will traditional record hear author. Report cause three total time difficult decade pull. Marriage strategy than push door sing small.,3981.87,Laptops,False
TVrB75qfeG,yXIelUJ9,ASUS ROG Swift PG259QN,Develop quite between. Tend carry hold image heavy. Event position statement themselves box something state a.,1701.77,Monitors,True
5VJXOHMxsG,F7jIVJ5V,Microsoft Surface Pro 7,Fish development brother project popular common. Add table why company institution.,1955.55,Tablets,True
st3VQxZExi,0K2NovJh,Apple Watch Series 7,Record also take choice deep. Before class east whatever near might dream. Him market which identify guess.,2471.99,Smartwatches,True
y9ERtp7oUK,ftOgcuUK,Microsoft Office 365,Live continue report receive. Chair reflect eight research score. Fast meeting play civil. Use before study like.,4995.86,Software,False
JyRm3nu6le,1CKcc2HK,Razer DeathAdder Elite,Tell you key usually possible.,314.72,Accessories,False
CQMi1XeegX,EghuUxG5,Google Pixel 7,Necessary trip physical cell seven. Body watch employee hot trade nation city. Know second ago right. Yeah property hope else as car.,4543.25,Smartphones,False
m26Gl48ey6,KZRSApIw,Asus ROG Zephyrus G14,Catch station whether their stuff.,4082.61,Laptops,True
7Cd0W1Q51o,O9hBwMy4,BenQ ZOWIE XL2411P,Defense together real hear. Political range book enter.,2739.62,Monitors,False
e9FCykaGoG,c5XVv3EY,Windows 11 Pro,Receive show them. Would remember likely course general yourself.,1355.42,Software,True
2KXFH9SnB4,I7TpAOnz,HP Spectre x360,Officer seem painting responsibility black effect. Quickly garden whom month structure likely minute treatment.,1378.08,Laptops,True
gLUqdoz3oe,WMpT6R5q,Oculus Quest 2,Send believe east no several federal avoid.,4794.3,Gaming Consoles,True
rqLvunW844,1EQi9wI8,Amazfit GTR 3,Newspaper more other not increase role born. Reach capital water go six yourself. National read right section.,4971.63,Smartwatches,False
cHGgH2krJA,ajxiQz6U,Sennheiser Momentum 3,This how husband great her involve. Mention decision give billion. Me result perform knowledge surface like. Describe fear hot past south.,2545.22,Headphones,True
ZWdISS8VPN,BIv2iERu,Oculus Quest 2,Affect none discover about pull he discuss. Move shake people possible.,3325.15,Gaming Consoles,True
2Pt9vlre8X,oQ1i6ZNS,Oculus Quest 2,Start difficult season conference nothing dream. Enjoy level how opportunity somebody here. Which low statement truth measure.,3573.81,Gaming Consoles,True
dVheSxlHP4,nhHmaaZa,Fitbit Versa 3,As politics security stuff material. Direction future he yes represent west place. On reality color support church.,1482.79,Smartwatches,False
Tc7R49vt2a,kbZFtljX,Google Pixel 7,Spring whether career speak easy. Pull pull less science father ago fire himself. Month where have peace.,1425.55,Smartphones,True
mqk3LMYuMY,jnh8Nrtw,Panasonic Lumix GH5,Ok history stage rather. True floor performance. Situation shake about investment.,868.01,Cameras,False
kpZe8MWXjs,y41uAiXI,Microsoft Office 365,Test she serve training think. Recognize reality bit whom third.,4961.14,Software,True
yg4pepR1FX,x0kN7c6k,LG UltraWide 34WN80C-B,Political position list series lead. Describe worker soldier scientist five wall. Work hot capital room common news car hold.,2301.41,Monitors,False
yr2RfxsKwa,hFNsIa9V,Lenovo ThinkPad X1,Bad movie effort summer. Reduce could change bar too.,2284.43,Laptops,True
IUoB3QYnTX,FjGrAOWi,Sony PlayStation 5,Star fact focus activity opportunity. True fight catch skin modern coach suddenly.,1195.44,Gaming Consoles,True
H97spjoflu,biopqIT4,Bose SoundLink Mini II,Guess area game sea government teach. Democratic official wind make pick theory since guy.,2714.41,Accessories,True
DNifQuIrff,svSuNHQw,Samsung Galaxy S21,Rather close key try capital. Recent laugh hold tree administration customer. Couple themselves happy it book in few.,395.92,Smartphones,False
1geUrGOkLX,HycLXhFi,Apple MacBook Pro,Blue he campaign pretty create ever human. They expect gas thousand happy probably forget major. Project party although rock. Right eight growth my fall moment.,3916.44,Laptops,True
6Lz0Jq4pgv,7ncc9vB5,Adobe Photoshop 2022,Girl network fight listen piece smile fly value. Reason whole board part true. Little question know around get.,1862.8,Software,True
w0QhPB3ia4,jDVRAtU2,Microsoft Xbox Series X,Result he think who simply read.,4171.35,Gaming Consoles,True
vme9kMyLda,nkq8HOoE,Dell XPS 13,Three exist church situation grow share scientist land. Medical actually material student more popular.,890.99,Laptops,False
ztBfzshT6W,eY0OmnFI,Apple iPhone 14,Cultural not go discuss institution possible mention. Space third us last production sell.,3103.77,Smartphones,True
JeUq9fMgWK,TdYOtISs,BenQ ZOWIE XL2411P,Especially reflect hour mouth. National leg mean institution project hour health type. Card pretty baby break.,3136.84,Monitors,True
ESHEsCJf1r,nE3bRK2z,Sony WH-1000XM4,Have standard medical do close. Her rise spring manager financial.,1727.95,Headphones,True
HZQuHea3EJ,TeKwsrJz,ASUS ROG Swift PG259QN,Seek adult family. Almost candidate play north owner parent certainly body.,595.47,Monitors,False
nXySkHQAI2,uvrnjC12,ASUS ROG Swift PG259QN,Center possible gas before majority reality wrong else. Memory never might girl nature career during color. Collection star pressure order.,1119.17,Monitors,False
yKParJOUpF,EcKGEosl,Xbox Series S,Easy age floor statement her young say common.,785.31,Gaming Consoles,False
92BMhoK74g,uP3XNCUH,Canon EOS R5,Job truth mind brother. No onto low involve stay. Among sea low lead.,1171.57,Cameras,True
Iq4xKDnUaZ,wkdbRnhF,Samsung Galaxy S21,Authority week technology figure any. A likely could learn say know step central. Dog meeting pick growth movement create evening.,4443.12,Smartphones,True
sajVGsg4GM,fDdPsK7S,Anker PowerCore 10000,School agency yeah above senior again military. Clearly north make particularly gas oil song focus. Score have year magazine.,3001.24,Accessories,True
diY1zRIgMh,boqDliBp,Sony Alpha a7 III,Suddenly building appear what evening. Mission several third industry stop bar work. She prevent number behind car among agreement gas.,4245.66,Cameras,False
ZLGGaSK0vI,rdoKoV1p,Apple iPhone 14,Employee hard majority above throughout. Direction station along direction focus contain feel team. Able charge whom produce.,2351.01,Smartphones,False
OM5BFisl6n,Vs25qiF5,Microsoft Surface Pro 7,Activity institution kind herself light forward success. Opportunity senior too particularly positive. Report candidate cut member whom hear money.,698.17,Tablets,True
A5A0HsXo6H,Wp2dO50c,JBL Live 650BTNC,By soon system hit. Accept agent toward phone entire degree skill. Of particularly bring last blue ability side.,886.72,Headphones,True
PB3fvdgN0y,YUhK39wV,Microsoft Surface Pro 7,Day where everyone same relate appear kind. A long seek thought wrong old. True grow accept than school able.,4692.84,Tablets,True
fAeHCFq2JU,hFCuJdMr,Lenovo Tab P11,Each whole month way dark. Point hard common identify serve.,4280.0,Tablets,False
6wYw33N9MR,ZQiWrz8Z,Xbox Series S,Fear break others their husband treatment. Statement bed should decade bill case later. Pretty nature imagine evidence around hair act industry.,645.53,Gaming Consoles,True
3SZuJicS8l,8naebPuL,Panasonic Lumix GH5,Trip film today analysis individual political. Decision beautiful fact trouble.,1579.34,Cameras,True
etBugyoD64,JS7gxtZc,Autodesk AutoCAD 2022,For occur good traditional until serious. Natural improve here floor. Senior school tend toward after show. In particularly back allow cold great unit.,132.53,Software,False
ApQLDELFJG,63WcZI18,Amazon Fire HD 10,Skin high go step. Off spring season land whose poor. Left toward tell gun business.,2147.25,Tablets,False
nFo4yOvyW0,DhHmMe0X,Xiaomi Mi 11,None eight board. Three win machine tax newspaper nation control. Purpose true manage between truth.,3772.57,Smartphones,True
Rp6tan7VaO,qiHB566l,Sony WH-1000XM4,Country new throughout them. I development nice second we deal.,1336.44,Headphones,False
6ieRMtPNk8,T5fHwNMj,HP Spectre x360,Time by near wife who increase head. Skill always sing defense middle low drop range.,4670.77,Laptops,True
LjDJYL8yJf,dsl775xK,Apple iPad Pro,Attention child brother food plant wonder. Five particular door no base.,517.14,Tablets,False
zf2ZwIXuWx,X8WbiZbG,Samsung Galaxy S21,Whether us this social. Story factor step. Drop position may pay heavy even full risk.,3381.79,Smartphones,False
1IUBiMqrjM,mrQKqlKs,Sennheiser Momentum 3,There show more painting miss main. Standard audience evidence successful ahead wonder effect suddenly.,3082.99,Headphones,True
505dYjKtFG,LePm7LNz,ASUS ROG Swift PG259QN,Shake front before change thing develop. Hope green catch these beat try attack.,4314.54,Monitors,False
eXMke1Ul8z,jdCc1f9j,Anker PowerCore 10000,Address agent though pattern save. Move product relate approach send goal.,3136.46,Accessories,True
dKERau5At6,GgMkYq9f,HP Spectre x360,Defense capital condition executive suddenly enough themselves student. Article whether shoulder environment.,2178.31,Laptops,True
VmxWEeBeN9,PaJTfXKR,LG UltraWide 34WN80C-B,Culture world free save Congress popular. Cultural mind phone move must thousand. Already political affect entire must baby walk take.,1760.74,Monitors,False
JC2u5d5lGQ,sRn0GNAO,Microsoft Xbox Series X,Seven near break enjoy spend while way. Picture open model level receive generation science culture.,4950.03,Gaming Consoles,True
wSlcSE9BNw,XDtqh8lL,Garmin Fenix 6,Rate reality site better factor camera dream lead. Artist article citizen then on establish they.,4938.6,Smartwatches,False
5nTLp5cATX,XcarSNl1,Dell XPS 13,Team common level wish ask civil. Management network garden quickly himself. Mission act partner he many truth population.,904.7,Laptops,True
